{
  "formatVersion": 1,
  "kind": "learnlab-author-delivery",
  "attemptId": "b992a911-9770-44b0-a681-00e1375c0aa2",
  "status": "created",
  "repository": "TheCharlesChristy/LearnLab",
  "branch": "feat/laboratory-circuits-networks",
  "base": "feat/laboratory-circuits-course",
  "headCommit": "99bca6fc7ad75afb7a2a89c1e90cbded2ad5daa3",
  "baseCommit": "40c19ea7f91bd6590cb3639a6293a01b227e5026",
  "title": "Add series and parallel research-station investigations",
  "bodySha256": "b8a0ddc6912b25d7d108b27c96fc2b465860111cb0a1e5c54ca38e26bb4498f5",
  "bodyBytes": 2669,
  "untrackedCount": 1,
  "untrackedPaths": [
    "node_modules"
  ],
  "range": {
    "commits": 1,
    "fileCount": 28,
    "files": [
      ".agents/skills/learnlab-lesson-pedagogy/SKILL.md",
      "authoring/drafts/research-station-networks/pack.json",
      "authoring/runs/research-station/artifacts/0075-scaffold.json",
      "authoring/runs/research-station/artifacts/0076-pack.json",
      "authoring/runs/research-station/artifacts/0077-research-ledger.json",
      "authoring/runs/research-station/artifacts/0078-learnlab-circuits-v5-units.log",
      "authoring/runs/research-station/artifacts/0079-learnlab-circuits-v5-units-retry.log",
      "authoring/runs/research-station/artifacts/0080-learnlab-circuits-v5-contracts-final.log",
      "authoring/runs/research-station/artifacts/0081-learnlab-circuits-v5-types.log",
      "authoring/runs/research-station/artifacts/0082-learnlab-circuits-v5-lint.log",
      "authoring/runs/research-station/artifacts/0083-learnlab-circuits-v5-content.log",
      "authoring/runs/research-station/artifacts/0084-learnlab-circuits-v5-build.log",
      "authoring/runs/research-station/artifacts/0085-learnlab-circuits-v5-browser-host-full.log",
      "authoring/runs/research-station/artifacts/0086-learnlab-circuits-v5-browser-webkit-full.log",
      "authoring/runs/research-station/artifacts/0087-CIRCUITS-EPISODES-5-6-VERIFICATION.md",
      "authoring/runs/research-station/artifacts/0088-station-parallel-branches.png",
      "authoring/runs/research-station/artifacts/0089-station-parallel-phone-expanded.png",
      "authoring/runs/research-station/manifest.json",
      "docs/laboratory/ACTIVITIES.md",
      "docs/laboratory/AUDIT.md",
      "docs/laboratory/AUTHORING-HARNESS.md",
      "docs/laboratory/CIRCUIT-MODEL.md",
      "docs/laboratory/CIRCUITS-EPISODES-5-6-VERIFICATION.md",
      "docs/laboratory/research-ledger.json",
      "e2e/laboratory.pw.ts",
      "public/laboratory/research-station/pack.json",
      "src/v2/contracts.test.ts",
      "src/v2/laboratory.css"
    ],
    "stat": " .agents/skills/learnlab-lesson-pedagogy/SKILL.md   |    2 +-\n .../drafts/research-station-networks/pack.json     | 1640 ++++++++++++++++++++\n .../research-station/artifacts/0075-scaffold.json  |   57 +\n .../runs/research-station/artifacts/0076-pack.json | 1640 ++++++++++++++++++++\n .../artifacts/0077-research-ledger.json            |  225 +++\n .../artifacts/0078-learnlab-circuits-v5-units.log  |  970 ++++++++++++\n .../0079-learnlab-circuits-v5-units-retry.log      |   11 +\n .../0080-learnlab-circuits-v5-contracts-final.log  |   11 +\n .../artifacts/0081-learnlab-circuits-v5-types.log  |    4 +\n .../artifacts/0082-learnlab-circuits-v5-lint.log   |   11 +\n .../0083-learnlab-circuits-v5-content.log          |    1 +\n .../artifacts/0084-learnlab-circuits-v5-build.log  |  244 +++\n ...0085-learnlab-circuits-v5-browser-host-full.log |   81 +\n ...86-learnlab-circuits-v5-browser-webkit-full.log |   21 +\n .../0087-CIRCUITS-EPISODES-5-6-VERIFICATION.md     |   69 +\n .../artifacts/0088-station-parallel-branches.png   |  Bin 0 -> 513626 bytes\n .../0089-station-parallel-phone-expanded.png       |  Bin 0 -> 1308992 bytes\n authoring/runs/research-station/manifest.json      |  155 ++\n docs/laboratory/ACTIVITIES.md                      |    7 +-\n docs/laboratory/AUDIT.md                           |    5 +-\n docs/laboratory/AUTHORING-HARNESS.md               |    2 +-\n docs/laboratory/CIRCUIT-MODEL.md                   |    2 +-\n .../CIRCUITS-EPISODES-5-6-VERIFICATION.md          |   69 +\n docs/laboratory/research-ledger.json               |   20 +\n e2e/laboratory.pw.ts                               |  141 ++\n public/laboratory/research-station/pack.json       |  650 +++++++-\n src/v2/contracts.test.ts                           |   69 +-\n src/v2/laboratory.css                              |   14 +-\n 28 files changed, 6105 insertions(+), 16 deletions(-)\n"
  },
  "url": "https://github.com/TheCharlesChristy/LearnLab/pull/74",
  "at": "2026-09-28T08:01:09.412Z"
}
