{
  "formatVersion": 1,
  "kind": "learnlab-author-delivery",
  "attemptId": "1104b790-1f88-4da2-a415-7fddcba57f5c",
  "status": "created",
  "repository": "TheCharlesChristy/LearnLab",
  "branch": "feat/laboratory-circuits-course",
  "base": "feat/laboratory-git-delivery",
  "headCommit": "7adcd94b2077f6afce0d9f8f1017a624518ac69f",
  "baseCommit": "eb30882c9695eedb4f256fb9e67a8ad136ada36a",
  "title": "Add three research-station circuit investigations",
  "bodySha256": "6515480af64199d4d8dc5197c4166cd3cf78ac4887127ad3d5daf8a93abba3f4",
  "bodyBytes": 2478,
  "untrackedCount": 1,
  "untrackedPaths": [
    "node_modules"
  ],
  "range": {
    "commits": 1,
    "fileCount": 31,
    "files": [
      ".agents/skills/learnlab-author-content/SKILL.md",
      ".agents/skills/learnlab-extend-platform/SKILL.md",
      ".agents/skills/learnlab-lesson-pedagogy/SKILL.md",
      "SRS-LearnLab.md",
      "authoring/runs/research-station/artifacts/0065-research-ledger.json",
      "authoring/runs/research-station/artifacts/0066-pack.json",
      "authoring/runs/research-station/artifacts/0067-learnlab-circuits-v4-units.log",
      "authoring/runs/research-station/artifacts/0068-learnlab-circuits-v4-browser-host.log",
      "authoring/runs/research-station/artifacts/0069-learnlab-circuits-v4-browser-webkit.log",
      "authoring/runs/research-station/artifacts/0070-learnlab-circuits-offline-browser.log",
      "authoring/runs/research-station/artifacts/0071-CIRCUITS-EPISODES-2-4-VERIFICATION.md",
      "authoring/runs/research-station/artifacts/0072-station-energy-console.png",
      "authoring/runs/research-station/artifacts/0073-station-energy-phone-expanded.png",
      "authoring/runs/research-station/manifest.json",
      "docs/laboratory/ACTIVITIES.md",
      "docs/laboratory/AUDIT.md",
      "docs/laboratory/AUTHORING-HARNESS.md",
      "docs/laboratory/CIRCUIT-MODEL.md",
      "docs/laboratory/CIRCUITS-EPISODES-2-4-VERIFICATION.md",
      "docs/laboratory/research-ledger.json",
      "e2e/laboratory.pw.ts",
      "public/laboratory/research-station/pack.json",
      "schemas/laboratory-pack.schema.json",
      "src/v2/CircuitActivity.tsx",
      "src/v2/LaboratoryPage.tsx",
      "src/v2/activity-contracts.json",
      "src/v2/contracts.test.ts",
      "src/v2/generated/validate-author-preview.mjs",
      "src/v2/generated/validate-pack.mjs",
      "src/v2/pack.ts",
      "src/v2/run.ts"
    ],
    "stat": " .agents/skills/learnlab-author-content/SKILL.md    |   6 +-\n .agents/skills/learnlab-extend-platform/SKILL.md   |   6 +-\n .agents/skills/learnlab-lesson-pedagogy/SKILL.md   |   7 +-\n SRS-LearnLab.md                                    |   5 +\n .../artifacts/0065-research-ledger.json            | 205 +++++\n .../runs/research-station/artifacts/0066-pack.json | 994 +++++++++++++++++++++\n .../artifacts/0067-learnlab-circuits-v4-units.log  |  11 +\n .../0068-learnlab-circuits-v4-browser-host.log     |  77 ++\n .../0069-learnlab-circuits-v4-browser-webkit.log   |  19 +\n .../0070-learnlab-circuits-offline-browser.log     |  53 ++\n .../0071-CIRCUITS-EPISODES-2-4-VERIFICATION.md     |  71 ++\n .../artifacts/0072-station-energy-console.png      | Bin 0 -> 460657 bytes\n .../0073-station-energy-phone-expanded.png         | Bin 0 -> 975034 bytes\n authoring/runs/research-station/manifest.json      |  90 ++\n docs/laboratory/ACTIVITIES.md                      |  23 +-\n docs/laboratory/AUDIT.md                           |  13 +-\n docs/laboratory/AUTHORING-HARNESS.md               |   2 +-\n docs/laboratory/CIRCUIT-MODEL.md                   |  10 +-\n .../CIRCUITS-EPISODES-2-4-VERIFICATION.md          |  71 ++\n docs/laboratory/research-ledger.json               |  20 +\n e2e/laboratory.pw.ts                               | 156 ++++\n public/laboratory/research-station/pack.json       | 634 ++++++++++++-\n schemas/laboratory-pack.schema.json                |  25 +-\n src/v2/CircuitActivity.tsx                         |  64 +-\n src/v2/LaboratoryPage.tsx                          |   1 +\n src/v2/activity-contracts.json                     |   8 +-\n src/v2/contracts.test.ts                           | 112 ++-\n src/v2/generated/validate-author-preview.mjs       |   2 +-\n src/v2/generated/validate-pack.mjs                 |   2 +-\n src/v2/pack.ts                                     |  80 +-\n src/v2/run.ts                                      |  30 +-\n 31 files changed, 2742 insertions(+), 55 deletions(-)\n"
  },
  "url": "https://github.com/TheCharlesChristy/LearnLab/pull/73",
  "at": "2026-09-28T07:40:26.455Z"
}
