{
  "formatVersion": 1,
  "kind": "learnlab-author-delivery",
  "attemptId": "a30ba482-8ad4-44e6-a83d-d542d7f3e1d2",
  "status": "created",
  "repository": "TheCharlesChristy/LearnLab",
  "branch": "feat/laboratory-meter-probes",
  "base": "feat/laboratory-circuits-networks",
  "headCommit": "b65da3f7d24bd10646a617177eb6594e1cf4a323",
  "baseCommit": "2d44130a4ce66b0d6e279191ba724592b4adf5fa",
  "title": "Add a diagnostic meter investigation to the research station",
  "bodySha256": "c4eaec435c0bfdcbe52fc83577eb75fb537cda401a7727eeaf2f273035fb6c23",
  "bodyBytes": 2339,
  "untrackedCount": 1,
  "untrackedPaths": [
    "node_modules"
  ],
  "range": {
    "commits": 1,
    "fileCount": 46,
    "files": [
      ".agents/skills/learnlab-author-content/SKILL.md",
      ".agents/skills/learnlab-extend-platform/SKILL.md",
      "authoring/drafts/research-station-meter/pack.json",
      "authoring/runs/research-station/artifacts/0091-scaffold.json",
      "authoring/runs/research-station/artifacts/0092-pack.json",
      "authoring/runs/research-station/artifacts/0093-meter-units.log",
      "authoring/runs/research-station/artifacts/0094-pack.json",
      "authoring/runs/research-station/artifacts/0095-pack.json",
      "authoring/runs/research-station/artifacts/0096-meter-units-final.log",
      "authoring/runs/research-station/artifacts/0097-meter-browser-full.log",
      "authoring/runs/research-station/artifacts/0098-meter-lint.log",
      "authoring/runs/research-station/artifacts/0099-meter-build.log",
      "authoring/runs/research-station/artifacts/0100-meter-units-pass.log",
      "authoring/runs/research-station/artifacts/0101-meter-browser-targeted.log",
      "authoring/runs/research-station/artifacts/0102-meter-browser-webkit.log",
      "authoring/runs/research-station/artifacts/0103-station-meter-diagnostic.png",
      "authoring/runs/research-station/artifacts/0104-meter-types-final.log",
      "authoring/runs/research-station/artifacts/0105-meter-lint-final.log",
      "authoring/runs/research-station/artifacts/0106-meter-contracts-final.log",
      "authoring/runs/research-station/artifacts/0107-meter-build-final.log",
      "authoring/runs/research-station/artifacts/0108-meter-legacy-strict.log",
      "authoring/runs/research-station/artifacts/0109-meter-webkit-phone.log",
      "authoring/runs/research-station/artifacts/0110-station-meter-phone-expanded.png",
      "authoring/runs/research-station/artifacts/0111-METER-DETECTIVE-VERIFICATION.md",
      "authoring/runs/research-station/manifest.json",
      "docs/laboratory/ACTIVITIES.md",
      "docs/laboratory/AUDIT.md",
      "docs/laboratory/AUTHORING-HARNESS.md",
      "docs/laboratory/METER-DETECTIVE-VERIFICATION.md",
      "docs/laboratory/research-ledger.json",
      "e2e/laboratory.pw.ts",
      "public/laboratory/research-station/pack.json",
      "schemas/laboratory-pack.schema.json",
      "src/v2/CircuitDiagram.tsx",
      "src/v2/LaboratoryPage.tsx",
      "src/v2/MeterProbeActivity.tsx",
      "src/v2/activity-contracts.json",
      "src/v2/author-preview.ts",
      "src/v2/generated/validate-author-preview.mjs",
      "src/v2/generated/validate-pack.mjs",
      "src/v2/laboratory.css",
      "src/v2/meter-probe.test.ts",
      "src/v2/meter-probe.ts",
      "src/v2/pack.ts",
      "src/v2/run.ts",
      "tests/pipeline/author-course.test.ts"
    ],
    "stat": " .agents/skills/learnlab-author-content/SKILL.md    |    4 +-\n .agents/skills/learnlab-extend-platform/SKILL.md   |    5 +-\n authoring/drafts/research-station-meter/pack.json  | 2058 ++++++++++++++++++++\n .../research-station/artifacts/0091-scaffold.json  |   57 +\n .../runs/research-station/artifacts/0092-pack.json | 2058 ++++++++++++++++++++\n .../artifacts/0093-meter-units.log                 |   38 +\n .../runs/research-station/artifacts/0094-pack.json | 2058 ++++++++++++++++++++\n .../runs/research-station/artifacts/0095-pack.json | 2058 ++++++++++++++++++++\n .../artifacts/0096-meter-units-final.log           |   35 +\n .../artifacts/0097-meter-browser-full.log          |  141 ++\n .../research-station/artifacts/0098-meter-lint.log |   11 +\n .../artifacts/0099-meter-build.log                 |  244 +++\n .../artifacts/0100-meter-units-pass.log            |   11 +\n .../artifacts/0101-meter-browser-targeted.log      |   53 +\n .../artifacts/0102-meter-browser-webkit.log        |   51 +\n .../artifacts/0103-station-meter-diagnostic.png    |  Bin 0 -> 246118 bytes\n .../artifacts/0104-meter-types-final.log           |    4 +\n .../artifacts/0105-meter-lint-final.log            |   11 +\n .../artifacts/0106-meter-contracts-final.log       |    5 +\n .../artifacts/0107-meter-build-final.log           |  244 +++\n .../artifacts/0108-meter-legacy-strict.log         |    1 +\n .../artifacts/0109-meter-webkit-phone.log          |   39 +\n .../0110-station-meter-phone-expanded.png          |  Bin 0 -> 1281986 bytes\n .../artifacts/0111-METER-DETECTIVE-VERIFICATION.md |   85 +\n authoring/runs/research-station/manifest.json      |  215 ++\n docs/laboratory/ACTIVITIES.md                      |   32 +-\n docs/laboratory/AUDIT.md                           |    9 +-\n docs/laboratory/AUTHORING-HARNESS.md               |    4 +-\n docs/laboratory/METER-DETECTIVE-VERIFICATION.md    |   85 +\n docs/laboratory/research-ledger.json               |   12 +-\n e2e/laboratory.pw.ts                               |  135 +-\n public/laboratory/research-station/pack.json       |  424 +++-\n schemas/laboratory-pack.schema.json                |   64 +\n src/v2/CircuitDiagram.tsx                          |   18 +-\n src/v2/LaboratoryPage.tsx                          |   45 +-\n src/v2/MeterProbeActivity.tsx                      |  142 ++\n src/v2/activity-contracts.json                     |   14 +\n src/v2/author-preview.ts                           |    3 +\n src/v2/generated/validate-author-preview.mjs       |    2 +-\n src/v2/generated/validate-pack.mjs                 |    2 +-\n src/v2/laboratory.css                              |    8 +\n src/v2/meter-probe.test.ts                         |  168 ++\n src/v2/meter-probe.ts                              |  123 ++\n src/v2/pack.ts                                     |    9 +-\n src/v2/run.ts                                      |   22 +\n tests/pipeline/author-course.test.ts               |    3 +-\n 46 files changed, 10784 insertions(+), 26 deletions(-)\n"
  },
  "url": "https://github.com/TheCharlesChristy/LearnLab/pull/75",
  "at": "2026-09-28T18:38:31.193Z"
}
